{"center_repo":"Agents-of-Abyss","decision_states":[{"may_open_arena":false,"meaning":"ordinary service or thin-route handling is still sufficient","state":"no_gate_service_route"},{"may_open_arena":false,"meaning":"routing may emit a pre-protocol candidate that a future center-owned gate can review","state":"agon_gate_candidate"},{"may_open_arena":false,"meaning":"routing may request missing signals before any gate candidate is meaningful","state":"agon_gate_candidate_missing_context"},{"may_open_arena":false,"meaning":"routing sends the task to the owning repository or proof layer before any Agon gate signal","state":"owner_review_required"},{"may_open_arena":false,"meaning":"routing may recommend stop or quarantine posture when boundary breach or hidden authority appears","state":"quarantine_hint"}],"owner_repo":"aoa-routing","route_hint_count":12,"route_hints":[{"assistant_allowed":["flag_boundary","prepare_receipt","handoff"],"assistant_forbidden":["grant_closure","issue_verdict","open_arena"],"decision_state":"agon_gate_candidate","hint_id":"agon_gate.contested_closure.v1","live_protocol":false,"primary_next_hop":"Agents-of-Abyss","recommended_lawful_moves":["deny_closure","request_closure_review","escalate_to_agon_gate"],"routing_action":"emit_agon_gate_candidate","routing_must_not_own":["no_arena_session_creation","no_sealed_commit","no_verdict","no_scar_write","no_retention_scheduling","no_rank_mutation","no_tos_promotion","no_runtime_dispatch_authority","no_source_meaning_rewrite"],"routing_owns":["thin pre-protocol gate hint","next-hop orientation"],"runtime_effect":"none","secondary_next_hops":["aoa-evals","aoa-playbooks"],"trigger_class":"closure","trigger_id":"contested_closure"},{"assistant_allowed":["flag_boundary","prepare_receipt","handoff"],"assistant_forbidden":["resolve_contradiction","issue_verdict","open_arena"],"decision_state":"agon_gate_candidate","hint_id":"agon_gate.open_material_contradiction.v1","live_protocol":false,"primary_next_hop":"Agents-of-Abyss","recommended_lawful_moves":["mark_contradiction","localize_contradiction","escalate_to_agon_gate"],"routing_action":"emit_agon_gate_candidate","routing_must_not_own":["no_arena_session_creation","no_sealed_commit","no_verdict","no_scar_write","no_retention_scheduling","no_rank_mutation","no_tos_promotion","no_runtime_dispatch_authority","no_source_meaning_rewrite"],"routing_owns":["thin pre-protocol gate hint","next-hop orientation"],"runtime_effect":"none","secondary_next_hops":["aoa-evals","aoa-playbooks"],"trigger_class":"contradiction","trigger_id":"open_material_contradiction"},{"assistant_allowed":["prepare_trace_receipt","flag_boundary","handoff"],"assistant_forbidden":["repair_trace_by_fiction","grant_closure","write_scar"],"decision_state":"agon_gate_candidate","hint_id":"agon_gate.broken_trace_or_trace_gap.v1","live_protocol":false,"primary_next_hop":"Agents-of-Abyss","recommended_lawful_moves":["probe_trace","deny_trace_closure","request_witness","escalate_to_agon_gate"],"routing_action":"emit_agon_gate_candidate","routing_must_not_own":["no_arena_session_creation","no_sealed_commit","no_verdict","no_scar_write","no_retention_scheduling","no_rank_mutation","no_tos_promotion","no_runtime_dispatch_authority","no_source_meaning_rewrite"],"routing_owns":["thin pre-protocol gate hint","next-hop orientation"],"runtime_effect":"none","secondary_next_hops":["aoa-evals","aoa-memo","aoa-playbooks"],"trigger_class":"trace","trigger_id":"broken_trace_or_trace_gap"},{"assistant_allowed":["request_missing_fields","prepare_receipt","handoff"],"assistant_forbidden":["invent_evidence","issue_verdict","open_arena"],"decision_state":"owner_review_required","hint_id":"agon_gate.evidence_floor_collapse.v1","live_protocol":false,"primary_next_hop":"aoa-evals","recommended_lawful_moves":["request_evidence","offer_evidence_reference","defer_with_cost","escalate_to_agon_gate"],"routing_action":"emit_owner_review_or_gate_candidate","routing_must_not_own":["no_arena_session_creation","no_sealed_commit","no_verdict","no_scar_write","no_retention_scheduling","no_rank_mutation","no_tos_promotion","no_runtime_dispatch_authority","no_source_meaning_rewrite"],"routing_owns":["thin pre-protocol gate hint","next-hop orientation"],"runtime_effect":"none","secondary_next_hops":["Agents-of-Abyss","aoa-playbooks"],"trigger_class":"evidence","trigger_id":"evidence_floor_collapse"},{"assistant_allowed":["flag_repetition","prepare_receipt","handoff"],"assistant_forbidden":["self_rewrite_policy","write_scar","grant_rank_change"],"decision_state":"agon_gate_candidate","hint_id":"agon_gate.repeated_failure_without_delta.v1","live_protocol":false,"primary_next_hop":"Agents-of-Abyss","recommended_lawful_moves":["challenge_claim","revise_position","defer_with_cost","escalate_to_agon_gate"],"routing_action":"emit_agon_gate_candidate","routing_must_not_own":["no_arena_session_creation","no_sealed_commit","no_verdict","no_scar_write","no_retention_scheduling","no_rank_mutation","no_tos_promotion","no_runtime_dispatch_authority","no_source_meaning_rewrite"],"routing_owns":["thin pre-protocol gate hint","next-hop orientation"],"runtime_effect":"none","secondary_next_hops":["aoa-memo","aoa-stats","aoa-playbooks"],"trigger_class":"failure","trigger_id":"repeated_failure_without_delta"},{"assistant_allowed":["flag_scope_breach","prepare_receipt","handoff"],"assistant_forbidden":["become_contestant","issue_verdict","self_promote"],"decision_state":"agon_gate_candidate","hint_id":"agon_gate.assistant_scope_breach.v1","live_protocol":false,"primary_next_hop":"aoa-agents","recommended_lawful_moves":["flag_scope_breach","request_witness","escalate_to_agon_gate"],"routing_action":"route_to_agonic_actor_or_gate_candidate","routing_must_not_own":["no_arena_session_creation","no_sealed_commit","no_verdict","no_scar_write","no_retention_scheduling","no_rank_mutation","no_tos_promotion","no_runtime_dispatch_authority","no_source_meaning_rewrite"],"routing_owns":["thin pre-protocol gate hint","next-hop orientation"],"runtime_effect":"none","secondary_next_hops":["Agents-of-Abyss","aoa-routing"],"trigger_class":"assistant","trigger_id":"assistant_scope_breach"},{"assistant_allowed":["stop_and_escalate","prepare_receipt"],"assistant_forbidden":["continue_hidden_drift","open_arena","self_rewrite_policy"],"decision_state":"quarantine_hint","hint_id":"agon_gate.assistant_anti_drift_alarm.v1","live_protocol":false,"primary_next_hop":"aoa-agents","recommended_lawful_moves":["flag_scope_breach","request_witness","escalate_to_agon_gate"],"routing_action":"emit_quarantine_hint_and_owner_review","routing_must_not_own":["no_arena_session_creation","no_sealed_commit","no_verdict","no_scar_write","no_retention_scheduling","no_rank_mutation","no_tos_promotion","no_runtime_dispatch_authority","no_source_meaning_rewrite"],"routing_owns":["thin pre-protocol gate hint","next-hop orientation"],"runtime_effect":"none","secondary_next_hops":["aoa-evals","Agents-of-Abyss"],"trigger_class":"assistant","trigger_id":"assistant_anti_drift_alarm"},{"assistant_allowed":["prepare_comparison_receipt","handoff"],"assistant_forbidden":["select_winner","issue_verdict","rewrite_actor_model"],"decision_state":"agon_gate_candidate","hint_id":"agon_gate.model_divergence_above_threshold.v1","live_protocol":false,"primary_next_hop":"Agents-of-Abyss","recommended_lawful_moves":["assert_position","challenge_claim","request_witness","escalate_to_agon_gate"],"routing_action":"emit_agon_gate_candidate","routing_must_not_own":["no_arena_session_creation","no_sealed_commit","no_verdict","no_scar_write","no_retention_scheduling","no_rank_mutation","no_tos_promotion","no_runtime_dispatch_authority","no_source_meaning_rewrite"],"routing_owns":["thin pre-protocol gate hint","next-hop orientation"],"runtime_effect":"none","secondary_next_hops":["aoa-agents","aoa-evals"],"trigger_class":"model_divergence","trigger_id":"model_divergence_above_threshold"},{"assistant_allowed":["flag_canon_risk","prepare_receipt","handoff"],"assistant_forbidden":["promote_to_tos","declare_canon","open_arena_as_canon"],"decision_state":"owner_review_required","hint_id":"agon_gate.canonical_risk.v1","live_protocol":false,"primary_next_hop":"Agents-of-Abyss","recommended_lawful_moves":["challenge_claim","request_evidence","defer_with_cost","escalate_to_agon_gate"],"routing_action":"emit_owner_review_or_gate_candidate","routing_must_not_own":["no_arena_session_creation","no_sealed_commit","no_verdict","no_scar_write","no_retention_scheduling","no_rank_mutation","no_tos_promotion","no_runtime_dispatch_authority","no_source_meaning_rewrite"],"routing_owns":["thin pre-protocol gate hint","next-hop orientation"],"runtime_effect":"none","secondary_next_hops":["Tree-of-Sophia","aoa-kag","aoa-evals"],"trigger_class":"canon","trigger_id":"canonical_risk"},{"assistant_allowed":["collect_summon_intent","prepare_receipt","handoff"],"assistant_forbidden":["summon_hidden_actor","grant_summon_authority","open_arena"],"decision_state":"owner_review_required","hint_id":"agon_gate.summon_intent_requires_review.v1","live_protocol":false,"primary_next_hop":"Agents-of-Abyss","recommended_lawful_moves":["request_summon_intent","request_witness","defer_with_cost","escalate_to_agon_gate"],"routing_action":"emit_summon_intent_review_hint","routing_must_not_own":["no_arena_session_creation","no_sealed_commit","no_verdict","no_scar_write","no_retention_scheduling","no_rank_mutation","no_tos_promotion","no_runtime_dispatch_authority","no_source_meaning_rewrite"],"routing_owns":["thin pre-protocol gate hint","next-hop orientation"],"runtime_effect":"none","secondary_next_hops":["aoa-agents","aoa-evals"],"trigger_class":"summon","trigger_id":"summon_intent_requires_review"},{"assistant_allowed":["flag_novelty","request_missing_fields","handoff"],"assistant_forbidden":["invent_new_policy","declare_canon","open_arena"],"decision_state":"agon_gate_candidate","hint_id":"agon_gate.novelty_above_